{
  "schema_version": "2.0",
  "baseline_id": "blind-case-structural-fixture",
  "case_id": "contract-fixture",
  "created_at": "2026-09-08T00:00:00Z",
  "question_ids": ["Q1", "Q2"],
  "frame_sha256": "aaaaaaaaaaaaaaaaaaaaaaaaaaaaaaaaaaaaaaaaaaaaaaaaaaaaaaaaaaaaaaaa",
  "input_manifest_sha256": "bbbbbbbbbbbbbbbbbbbbbbbbbbbbbbbbbbbbbbbbbbbbbbbbbbbbbbbbbbbbbbbb",
  "baselines": [
    {"question_id": "Q1", "baseline_id": "blind-q1-fixture", "freeze_id": "freeze-q1-fixture", "path": "reference_baselines/blind-q1-fixture.json", "sha256": "cccccccccccccccccccccccccccccccccccccccccccccccccccccccccccccccc"},
    {"question_id": "Q2", "baseline_id": "blind-q2-fixture", "freeze_id": "freeze-q2-fixture", "path": "reference_baselines/blind-q2-fixture.json", "sha256": "dddddddddddddddddddddddddddddddddddddddddddddddddddddddddddddddd"}
  ],
  "scope": "host_observed_all_question_pre_reference_baseline",
  "paper_acceptance": "NOT_RUN"
}
